O Que,Para Quem,Quando,Como,Responsável
Relatório Semanal de Status,"Diretoria de TI, Diretoria Financeira",Semanal (segundas),Email + PDF resumo,Gerente de Projeto (Matheus Lima)
Alerta de Manutenção,"Facilities, Diretoria de TI, Funcionários afetados",Ad-hoc (quando houver manutenção),Email e aviso no Slack/Teams,Facilities
Newsletter Mensal do Projeto,Todos os Funcionários,Mensal,Intranet / Newsletter por email,Recursos Humanos
Relatório de ROI Inicial,"Diretoria Financeira, Diretoria de TI",Após 30/60/90 dias de operação,Apresentação + Documento técnico,Gerente de Projeto (Matheus Lima)
Sessões de Feedback com Usuários,Funcionários (amostragem),Bimensal durante piloto,Workshops presenciais / Formulários online,Recursos Humanos
